"Title","Year","Venue","Venue Short","Authors","ISSN","Qualis CAPES"
"Optimizing computational costs of Spark for SARS-CoV-2 sequences comparisons on a commercial cloud.","2023","Concurrency and Computation: Practice and Experience","Concurr. Comput. Pract. Exp.","Alan L. Nunes;Alba C. M. A. Melo;Claude Tadonki;Cristina Boeres;Daniel de Oliveira 0001;Lúcia Maria de Assumpção Drummond","1096-9128","A3"
"Parallel Fine-Grained Comparison of Long DNA Sequences in Homogeneous and Heterogeneous GPU Platforms With Pruning.","2021","IEEE Transactions on Parallel and Distributed Systems (TPDS)","IEEE Trans. Parallel Distributed Syst.","Marco Antonio C. de Figueiredo;João Paulo Navarro;Edans Flavius de Oliveira Sandes;George Teodoro;Alba C. M. A. Melo","1558-2183","A1"
"MASA-OpenCL: Parallel pruned comparison of long DNA sequences with OpenCL.","2019","Concurrency and Computation: Practice and Experience","Concurr. Comput. Pract. Exp.","Marco Antonio C. de Figueiredo;Edans Flavius de Oliveira Sandes;Genaína Nunes Rodrigues;George Luiz Medeiros Teodoro;Alba Cristina Magalhaes Alves de Melo","1096-9128","A3"
"AFMC: An alignment framework for multiple computing services and providers.","2023","Concurrency and Computation: Practice and Experience","Concurr. Comput. Pract. Exp.","Leonardo Rebouças de Carvalho;Alba Cristina Magalhaes Alves de Melo;Aletéia P. F. Araújo","1096-9128","A3"
"Bitmap filter: Speeding up exact set similarity joins with bitwise operations.","2020","Information Systems","Inf. Syst.","Edans F. de O. Sandes;George Luiz Medeiros Teodoro;Alba C. M. A. Melo","0306-4379","A2"
"Using Multiple Fickett Bands to Accelerate Biological Sequence Comparisons.","2019","Journal of Computational Biology (JCB)","J. Comput. Biol.","Gabriel H. G. Silva;Edans F. de O. Sandes;George Teodoro;Alba C. M. A. Melo","1557-8666","A2"
"DNA sequences alignment in multi-GPUs: acceleration and energy payoff.","2018","BMC Bioinformatics","BMC Bioinform.","Jesús Pérez Serrano;Edans F. de O. Sandes;Alba Cristina Magalhaes Alves de Melo;Manuel Ujaldón","1471-2105","A1"
"Formalization of Block Pruning: Reducing the Number of Cells Computed in Exact Biological Sequence Comparison Algorithms.","2018","The Computer Journal","Comput. J.","Edans Flavius de Oliveira Sandes;George Luiz Medeiros Teodoro;Maria Emília M. T. Walter;Xavier Martorell;Eduard Ayguadé;Alba Cristina Magalhaes Alves de Melo","N/A","N/A"
"Bitmap Filter: Speeding up Exact Set Similarity Joins with Bitwise Operations.","2017","Computing Research Repository (CoRR)","CoRR","Edans F. de O. Sandes;George Teodoro;Alba C. M. A. Melo","N/A","N/A"
"Parallel Optimal Pairwise Biological Sequence Comparison: Algorithms, Platforms, and Classification.","2016","ACM Computing Surveys","ACM Comput. Surv.","Edans Flavius de Oliveira Sandes;Azzedine Boukerche;Alba Cristina Magalhaes Alves de Melo","0360-0300","A1"
"MASA: A Multiplatform Architecture for Sequence Aligners with Block Pruning.","2016","ACM Transactions on Parallel Computing","ACM Trans. Parallel Comput.","Edans Flavius de Oliveira Sandes;Guillermo Miranda;Xavier Martorell;Eduard Ayguadé;George Teodoro;Alba Cristina Magalhaes Alves de Melo","2329-4949","A4"
"CUDAlign 4.0: Incremental Speculative Traceback for Exact Chromosome-Wide Alignment in GPU Clusters.","2016","IEEE Transactions on Parallel and Distributed Systems (TPDS)","IEEE Trans. Parallel Distributed Syst.","Edans Flavius de Oliveira Sandes;Guillermo Miranda;Xavier Martorell;Eduard Ayguadé;George Teodoro;Alba Cristina Magalhaes Alves de Melo","1558-2183","A1"
"An agent-based solution for dynamic multi-node wavefront balancing in biological sequence comparison.","2014","Expert Systems with Applications","Expert Syst. Appl.","Edans Flavius de Oliveira Sandes;Célia Ghedini Ralha;Alba Cristina Magalhaes Alves de Melo","0957-4174","A1"
"Querying dynamic communities in online social networks.","2014","Frontiers of Information Technology &#38; Electronic Engineering","J. Zhejiang Univ. Sci. C","Li Weigang 0001;Edans F. de O. Sandes;Jianya Zheng;Alba Cristina Magalhaes Alves de Melo;Lorna Uden","2095-9230","A4"
"Retrieving Smith-Waterman Alignments with Optimizations for Megabase Biological Sequences Using GPU.","2013","IEEE Transactions on Parallel and Distributed Systems (TPDS)","IEEE Trans. Parallel Distributed Syst.","Edans Flavius de Oliveira Sandes;Alba Cristina Magalhaes Alves de Melo","1558-2183","A1"
"MAS-Cloud+: A novel multi-agent architecture with reasoning models for resource management in multiple providers.","2024","Future Generation Computer Systems","Future Gener. Comput. Syst.","Aldo H. D. Mendes;Michel J. F. Rosa;Marcelo Antonio Marotta;Aletéia P. F. Araújo;Alba C. M. A. Melo;Célia Ghedini Ralha","0167-739X","A1"
"Adaptive patch grid strategy for parallel protein folding using atomic burials with NAMD.","2024","Journal of Parallel and Distributed Computing","J. Parallel Distributed Comput.","Emerson de Araujo Macedo;Alba C. M. A. Melo","1096-0848","A2"
"Efficient microscopy image analysis on CPU-GPU systems with cost-aware irregular data partitioning.","2022","Journal of Parallel and Distributed Computing","J. Parallel Distributed Comput.","Willian Barreiros Jr.;Alba C. M. A. Melo;Jun Kong;Renato Ferreira 0001;Tahsin M. Kurç;Joel H. Saltz;George Teodoro","1096-0848","A2"
"Optimizing parameter sensitivity analysis of large-scale microscopy image analysis workflows with multilevel computation reuse.","2020","Concurrency and Computation: Practice and Experience","Concurr. Comput. Pract. Exp.","Willian Barreiros Jr.;Jeremias Moreira;Tahsin M. Kurç;Jun Kong;Alba C. M. A. Melo;Joel H. Saltz;George Teodoro","1096-9128","A3"
"Sensitivity analysis in digital pathology: Handling large number of parameters with compute expensive workflows.","2019","Computers in Biology and Medicine","Comput. Biol. Medicine","Jeremias M. Gomes;Willian Barreiros Jr.;Tahsin M. Kurç;Alba C. M. A. Melo;Jun Kong;Joel H. Saltz;George Teodoro","0010-4825","A2"
"Multiagent system for dynamic resource provisioning in cloud computing platforms.","2019","Future Generation Computer Systems","Future Gener. Comput. Syst.","Célia Ghedini Ralha;Aldo H. D. Mendes;Luiz A. Laranjeira;Aletéia P. F. Araújo;Alba C. M. A. Melo","0167-739X","A1"
"Run-time Parameter Sensitivity Analysis Optimizations.","2019","Computing Research Repository (CoRR)","CoRR","Eduardo Scartezini;Willian Barreiros Jr.;Tahsin M. Kurç;Jun Kong;Alba C. M. A. Melo;Joel H. Saltz;George Teodoro","N/A","N/A"
"Dohko: an autonomic system for provision, configuration, and management of inter-cloud environments based on a software product line engineering method.","2017","Cluster Computing","Clust. Comput.","Alessandro Ferreira Leite;Vander Alves;Genaína Nunes Rodrigues;Claude Tadonki;Christine Eisenbeis;Alba Cristina Magalhaes Alves de Melo","1386-7857","A2"
"Multiple biological sequence alignment in heterogeneous multicore clusters with user-selectable task allocation policies.","2013","The Journal of Supercomputing","J. Supercomput.","Emerson de Araujo Macedo;Alba Cristina Magalhaes Alves de Melo;Gerson Henrique Pfitscher;Azzedine Boukerche","0920-8542","A2"
"A Novel Statistical and Neural Network Combined Approach for the Cloud Spot Market.","2023","IEEE Transactions on Cloud Computing","IEEE Trans. Cloud Comput.","Gustavo Portella;Eduardo Yoshio Nakano;Genaína Nunes Rodrigues;Azzedine Boukerche;Alba C. M. A. Melo","2168-7161","A1"
"Building robust pathology image analyses with uncertainty quantification.","2021","Computer Methods and Programs in Biomedicine","Comput. Methods Programs Biomed.","Jeremias M. Gomes;Jun Kong;Tahsin M. Kurç;Alba C. M. A. Melo;Renato Ferreira 0001;Joel H. Saltz;George Teodoro","0169-2607","A1"
"A CPU-FPGA heterogeneous approach for biological sequence comparison using high-level synthesis.","2021","Concurrency and Computation: Practice and Experience","Concurr. Comput. Pract. Exp.","Carlos Antônio Campos Jorge;Alexandre Solon Nery;Alba C. M. A. Melo;Alfredo Goldman","1096-9128","A3"
"Using GPU to accelerate the pairwise structural RNA alignment with base pair probabilities.","2020","Concurrency and Computation: Practice and Experience","Concurr. Comput. Pract. Exp.","Daniel Sundfeld;George Teodoro;Jakob Hull Havgaard;Jan Gorodkin;Alba C. M. A. Melo","1096-9128","A3"
"Statistical analysis of Amazon EC2 cloud pricing models.","2019","Concurrency and Computation: Practice and Experience","Concurr. Comput. Pract. Exp.","Gustavo Portella;Genaína Nunes Rodrigues;Eduardo Yoshio Nakano;Alba C. M. A. Melo","1096-9128","A3"
"Multi-objective Parameter Auto-tuning for Tissue Image Segmentation Workflows.","2019","Journal of Imaging Informatics in Medicine","J. Digit. Imaging","Luis F. R. Taveira;Tahsin M. Kurç;Alba C. M. A. Melo;Jun Kong;Erich Bremer;Joel H. Saltz;George Teodoro","N/A","N/A"
"Trends on heterogeneous and innovative hardware and software systems.","2019","Journal of Parallel and Distributed Computing","J. Parallel Distributed Comput.","Alba de Melo;Jesús Carretero 0001;Per Stenström;Sanjay Ranka;Eduard Ayguadé","1096-0848","A2"
"Cooperative and out-of-core execution of the irregular wavefront propagation pattern on hybrid machines with Intel® Xeon Phi™.","2018","Concurrency and Computation: Practice and Experience","Concurr. Comput. Pract. Exp.","Jeremias M. Gomes;Alba Cristina Magalhaes Alves de Melo;Jun Kong;Tahsin M. Kurç;Joel H. Saltz;George Teodoro","1096-9128","A3"
"PA-Star: A disk-assisted parallel A-Star strategy with locality-sensitive hash for multiple sequence alignment.","2018","Journal of Parallel and Distributed Computing","J. Parallel Distributed Comput.","Daniel Sundfeld;Caina Razzolini;George Teodoro;Azzedine Boukerche;Alba Cristina Magalhaes Alves de Melo","1096-0848","A2"
"Tuning for Tissue Image Segmentation Workflows for Accuracy and Performance.","2018","Computing Research Repository (CoRR)","CoRR","Luis F. R. Taveira;Tahsin M. Kurç;Alba C. M. A. Melo;Jun Kong;Erich Bremer;Joel H. Saltz;George Teodoro","N/A","N/A"
"Algorithm sensitivity analysis and parameter tuning for tissue image segmentation pipelines.","2017","Bioinformatics","Bioinform.","George Teodoro;Tahsin M. Kurç;Luis F. R. Taveira;Alba C. M. A. Melo;Yi Gao 0002","2227-9709","C"
"Foldalign 2.5: multithreaded implementation for pairwise structural RNA alignment.","2016","Bioinformatics","Bioinform.","Daniel Sundfeld;Jakob Hull Havgaard;Alba Cristina Magalhaes Alves de Melo;Jan Gorodkin","2227-9709","C"
"Power-aware server consolidation for federated clouds.","2016","Concurrency and Computation: Practice and Experience","Concurr. Comput. Pract. Exp.","Alessandro Ferreira Leite;Azzedine Boukerche;Alba Cristina Magalhaes Alves de Melo;Christine Eisenbeis;Claude Tadonki;Célia Ghedini Ralha","1096-9128","A3"
"Efficient Methods and Parallel Execution for Algorithm Sensitivity Analysis with Parameter Tuning on Microscopy Imaging Datasets.","2016","Computing Research Repository (CoRR)","CoRR","George Teodoro;Tahsin M. Kurç;Luis F. R. Taveira;Alba C. M. A. Melo;Jun Kong;Joel H. Saltz","N/A","N/A"
"A Framework for Adaptive Fault-Tolerant Execution of Workflows in the Grid: Empirical and Theoretical Analysis.","2014","Journal of Grid Computing","J. Grid Comput.","Felipe Pontes Guimarães;Pedro Célestin;Daniel Macêdo Batista;Genaína Nunes Rodrigues;Alba Cristina Magalhaes Alves de Melo","1570-7873","A1"
"Parallel Smith-Waterman Comparison on Multicore and Manycore Computing Platforms with BSP++.","2013","International Journal of Parallel Programming","Int. J. Parallel Program.","Khaled Hamidouche;Fernando Machado Mendonca;Joel Falcou;Alba Cristina Magalhaes Alves de Melo;Daniel Etiemble","0885-7458","A4"
"Mundo Bit Byte - A digital mobile game to disseminate female personalities that made history in Computing.","2022","Journal on Interactive Systems (JIS)","J. Interact. Syst.","Aletéia P. F. Araújo;Ana Júlia Luziano Briceño;Ana Sofia S. Silvestre;Bianca P. Castro;Carla Denise Castanho;Carla Koike;Fernanda S. Marcilio;Hanani E. F. Soares;Maristela Holanda;Mauricio Miranda Sarmet;Roberta B. Oliveira;Tais A. Oliveira;Thamires P. Silva","2236-3297","B1"
"Optimized Solutions for Deploying a Militarized 4G/LTE Network With Maximum Coverage and Minimum Interference.","2022","IEEE Transactions on Network and Service Management","IEEE Trans. Netw. Serv. Manag.","Emerson de O. Antunes;Marcos F. Caetano;Marcelo Antonio Marotta;Aletéia P. F. Araújo;Lucas Bondan;Rodolfo I. Meneguette;Geraldo P. Rocha Filho","1932-4537","A1"
"MAS-Cloud+: A novel multi-agent architecture with reasoning models for resource management in multiple providers.","2024","Future Generation Computer Systems","Future Gener. Comput. Syst.","Aldo H. D. Mendes;Michel J. F. Rosa;Marcelo Antonio Marotta;Aletéia P. F. Araújo;Alba C. M. A. Melo;Célia Ghedini Ralha","0167-739X","A1"
"Computational Resource Allocation in Fog Computing: A Comprehensive Survey.","2023","ACM Computing Surveys","ACM Comput. Surv.","João Bachiega Jr.;Breno G. S. Costa;Leonardo Rebouças de Carvalho;Michel J. F. Rosa;Aletéia P. F. Araújo","0360-0300","A1"
"Monitoring fog computing: A review, taxonomy and open challenges.","2022","Computer Networks","Comput. Networks","Breno G. S. Costa;João Bachiega Jr.;Leonardo Rebouças de Carvalho;Michel J. F. Rosa;Aletéia P. F. Araújo","1389-1286","A1"
"Monitoring Fog Computing: a Review, Taxonomy and Open Challenges.","2022","Computing Research Repository (CoRR)","CoRR","Breno G. S. Costa;João Bachiega Jr.;Leonardo Rebouças de Carvalho;Michel J. F. Rosa;Aletéia P. F. Araújo","N/A","N/A"
"Computational resource and cost prediction service for scientific workflows in federated clouds.","2021","Future Generation Computer Systems","Future Gener. Comput. Syst.","Michel J. F. Rosa;Célia Ghedini Ralha;Maristela Holanda;Aletéia P. F. Araújo","0167-739X","A1"
"The Brazilian School Girls' Perspectives on a Computer Science Major.","2020","CLEI electronic journal","CLEI Electron. J.","Maristela Holanda;Roberto Nunes Mourão;Guilherme Novaes Ramos;Aletéia P. F. Araújo;Maria Emília M. T. Walter;Vinicius Borges;George von Borries","0717-5000","B2"
"Managing data provenance for bioinformatics workflows using AProvBio.","2019","International Journal of Computational Biology and Drug Design (IJCBDD)","Int. J. Comput. Biol. Drug Des.","Rodrigo F. Almeida;Waldeyr Mendes Cordeiro da Silva;Klayton Castro;Aletéia Patrícia Favacho de Araújo;Maria Emília Telles Walter;Sérgio Lifschitz;Maristela Holanda","1756-0764","B2"
"BioNimbuZ: a federated cloud platform for bioinformatics applications.","2017","International Journal of Data Mining and Bioinformatics (IJDMB)","Int. J. Data Min. Bioinform.","Aletéia Patrícia Favacho de Araújo;Michel J. F. Rosa;Breno Moura;Guilherme Vergara;Maristela Holanda;Maria Emília Telles Walter","1748-5673","A3"
"WIT comes of Age: The Successful Story of the Women in Information Technology Workshop.","2025","Journal of the Brazilian Computer Society","J. Braz. Comput. Soc.","Luciana C. de C. Salgado;Mirella M. Moro;Aleteia Araujo;Renata V. De Figueiredo;Claudia Cappelli;Fabíola G. Nakamura;Thalia S. Santana","1678-4804","A2"
"Main FaaS Providers Behavior Under High Concurrency: An Evaluation with Orama Framework Distributed Architecture.","2024","SN Computer Science","SN Comput. Sci.","Leonardo Rebouças de Carvalho;Bruno Kamienski;Aletéia P. F. Araújo","2661-8907","B2"
"Achieving Observability on Fog Computing with the use of open-source tools.","2024","Computing Research Repository (CoRR)","CoRR","Breno G. S. Costa;Abhik Banerjee;Prem Prakash Jayaraman;Leonardo R. Carvalho;João Bachiega Jr.;Aleteia Araujo","N/A","N/A"
"Observability in Fog Computing.","2024","Computing Research Repository (CoRR)","CoRR","Aleteia Araujo;Breno G. S. Costa;João Bachiega Jr.;Leonardo R. Carvalho;Rajkumar Buyya","N/A","N/A"
"FaaS-Oriented Node.js Applications in an RPC Approach Using the Node2FaaS Framework.","2023","IEEE Access","IEEE Access","Leonardo Rebouças de Carvalho;Aletéia Patrícia Favacho de Araújo","2169-3536","A3"
"AFMC: An alignment framework for multiple computing services and providers.","2023","Concurrency and Computation: Practice and Experience","Concurr. Comput. Pract. Exp.","Leonardo Rebouças de Carvalho;Alba Cristina Magalhaes Alves de Melo;Aletéia P. F. Araújo","1096-9128","A3"
"Orchestration in Fog Computing: A Comprehensive Survey.","2023","ACM Computing Surveys","ACM Comput. Surv.","Breno G. S. Costa;João Bachiega Jr.;Leonardo Rebouças de Carvalho;Aletéia P. F. Araújo","0360-0300","A1"
"Insights into the Performance of Function-as-a-Service Oriented Environments Using the Orama Framework.","2023","SN Computer Science","SN Comput. Sci.","Leonardo Rebouças de Carvalho;Aletéia P. F. Araújo","2661-8907","B2"
"Computational Perspective of the Fog Node.","2022","Computing Research Repository (CoRR)","CoRR","João Bachiega Jr.;Breno G. S. Costa;Aletéia P. F. Araújo","N/A","N/A"
"A proposal to minimize the cost of processing big geospatial data in public cloud providers.","2021","Transactions in GIS","Trans. GIS","João Bachiega Jr.;Maristela Holanda;Aletéia P. F. Araújo","1361-1682","A2"
"Multiagent system for dynamic resource provisioning in cloud computing platforms.","2019","Future Generation Computer Systems","Future Gener. Comput. Syst.","Célia Ghedini Ralha;Aldo H. D. Mendes;Luiz A. Laranjeira;Aletéia P. F. Araújo;Alba C. M. A. Melo","0167-739X","A1"
"HCEm model and a comparative workload analysis of Hadoop cluster.","2017","International Journal of Big Data Intelligence (IJBDI)","Int. J. Big Data Intell.","Jose Benedito de Souza Brito;Aletéia Patrícia Favacho de Araújo","1448-5869","B3"
"Hiding color watermarks in halftone images using maximum-similarity binary patterns.","2016","Signal Processing: Image Communication","Signal Process. Image Commun.","Pedro Garcia Freitas;Mylène C. Q. Farias;Aletéia P. F. Araújo","0923-5965","A2"
"Enhancing inverse halftoning via coupled dictionary training.","2016","Signal Processing: Image Communication","Signal Process. Image Commun.","Pedro Garcia Freitas;Mylène C. Q. Farias;Aletéia P. F. Araújo","0923-5965","A2"
"Multicolour paths in graphs: NP-hardness, algorithms, and applications on routing in WDM networks.","2017","Journal of Combinatorial Optimization","J. Comb. Optim.","Rafael F. Santos;Alessandro Andrioni;André C. Drummond;Eduardo C. Xavier","1382-6905","A2"
"Minimizing unavailability in Elastic Optical Networks: Pre-provisioning and provisioning protection strategy using DLP and DPP.","2025","Computer Networks","Comput. Networks","Paulo José S. Júnior;Lucas Rodrigues Costa;André C. Drummond;Marcelo Antonio Marotta","1389-1286","A1"
"Maximizing Throughput with Routing Interference Avoidance in RIS-Assisted Relay Mesh Networks.","2024","Computing Research Repository (CoRR)","CoRR","Cao Vien Phung;André C. Drummond;Admela Jukan","N/A","N/A"
"Enhancing Path Selections with Interference Graphs in Multihop Relay Wireless Networks.","2024","Computing Research Repository (CoRR)","CoRR","Cao Vien Phung;André C. Drummond;Admela Jukan","N/A","N/A"
"An Optimization Driven Link SINR Assurance in RIS-assisted Indoor Networks.","2024","Computing Research Repository (CoRR)","CoRR","Cao Vien Phung;Max Franke;Ehsan Tohidi;June Heinemann;André C. Drummond;Stefan Schmid 0001;Slawomir Stanczak;Admela Jukan","N/A","N/A"
"Semantic Communication for Edge Intelligence: Theoretical Foundations and Implications on Protocols.","2023","IEEE Internet of Things Magazine","IEEE Internet Things Mag.","Zoran Utkovski;Andrea Munari;Giuseppe Caire;Johannes Dommel;Pin-Hsun Lin;Max Franke;André C. Drummond;Slawomir Stanczak","2576-3199","B1"
"Metropolitan optical networks: A survey on single-layer architectures.","2023","Optical Switching and Networking","Opt. Switch. Netw.","Léia Sousa de Sousa;André C. Drummond","1573-4277","A3"
"Metropolitan Optical Networks: A Survey on New Architectures and Future Trends.","2022","Computing Research Repository (CoRR)","CoRR","Léia Sousa de Sousa;André Costa Drummond","N/A","N/A"
"On the Efficiency and Quality of Protection of Preprovisioning in Elastic Optical Networks.","2022","Computing Research Repository (CoRR)","CoRR","Paulo José S. Júnior;Lucas Rodrigues Costa;André C. Drummond","N/A","N/A"
"Parallel Downlink Data Distribution in Indoor Multi-hop THz Networks.","2022","Computing Research Repository (CoRR)","CoRR","Cao Vien Phung;André C. Drummond;Admela Jukan","N/A","N/A"
"Energy Efficiency in Sliceable-Transponder Enabled Elastic Optical Networks.","2021","IEEE Transactions on Green Communications and Networking","IEEE Trans. Green Commun. Netw.","Lucas Rodrigues Costa;Ítalo Barbosa Brasileiro;André C. Drummond","2473-2400","A3"
"A survey on challenges of Spatial Division Multiplexing enabled elastic optical networks.","2020","Optical Switching and Networking","Opt. Switch. Netw.","Ítalo Brasileiro;Lucas Rodrigues Costa;André C. Drummond","1573-4277","A3"
"Embedding Jamming Attacks into Physical Layer Models in Optical Networks.","2020","Computing Research Repository (CoRR)","CoRR","Mounir Bensalem;Ítalo Brasileiro;André C. Drummond;Admela Jukan","N/A","N/A"
"Dynamic Multi-Modulation Allocation Scheme for Elastic Optical Networks.","2020","Computing Research Repository (CoRR)","CoRR","Lucas Rodrigues Costa;André C. Drummond","N/A","N/A"
"Jamming-Aware Control Plane in Elastic Optical Networks.","2020","Computing Research Repository (CoRR)","CoRR","Ítalo Brasileiro;Mounir Bensalem;André C. Drummond;Admela Jukan","N/A","N/A"
"A survey on Crosstalk and Routing, Modulation Selection, Core and Spectrum Allocation in Elastic Optical Networks.","2019","Computing Research Repository (CoRR)","CoRR","Ítalo Brasileiro;Lucas Rodrigues Costa;André C. Drummond","N/A","N/A"
"A Survey of Random Forest Based Methods for Intrusion Detection Systems.","2018","ACM Computing Surveys","ACM Comput. Surv.","Paulo Angelo Alves Resende;André Costa Drummond","0360-0300","A1"
"High-performance IP lookup using Intel Xeon Phi: a Bloom filters based approach.","2018","Journal of Internet Services and Applications","J. Internet Serv. Appl.","Alexandre Lucchesi;André C. Drummond;George Teodoro","1867-4828","A2"
"Adaptive anomaly-based intrusion detection system using genetic algorithm and profiling.","2018","Security and Privacy","Secur. Priv.","Paulo Angelo Alves Resende;André Costa Drummond","2475-6725","B2"
"HTTP and contact-based features for Botnet detection.","2018","Security and Privacy","Secur. Priv.","Paulo Angelo Alves Resende;André Costa Drummond","2475-6725","B2"
"New Distance-Adaptive Modulation Scheme for Elastic Optical Networks.","2017","IEEE Communications Letters","IEEE Commun. Lett.","Lucas Rodrigues Costa;André C. Drummond","1558-2558","A1"
"Leveraging adaptive modulation with multi-hop routing in elastic optical networks.","2016","Computer Networks","Comput. Networks","Lucas Rodrigues Costa;Guilherme Novaes Ramos;André C. Drummond","1389-1286","A1"
"Schemes for inter-domain lightpath establishment based on PCE architecture.","2016","Optical Switching and Networking","Opt. Switch. Netw.","Alisson S. L. Pontes;Nelson L. S. da Fonseca;André C. Drummond","1573-4277","A3"
"Holding-time-aware dynamic traffic grooming algorithms based on multipath routing for WDM optical networks.","2015","Optical Switching and Networking","Opt. Switch. Netw.","Juliana de Santi;André C. Drummond;Nelson L. S. da Fonseca;Xiaomin Chen","1573-4277","A3"
"Learning-Based Image Compression With Parameter-Adaptive Rate-Constrained Loss.","2024","IEEE Signal Processing Letters","IEEE Signal Process. Lett.","Nilson Donizete Guerin Júnior;Renam Castro da Silva;Bruno Macchiavello","1070-9908","A1"
"Rate-constrained learning-based image compression.","2022","Signal Processing: Image Communication","Signal Process. Image Commun.","Nilson Donizete Guerin Júnior;Renam Castro da Silva;Matheus C. de Oliveira;Henrique Costa Jung;Luiz Gustavo R. Martins;Eduardo Peixoto;Bruno Macchiavello;Edson M. Hung;Vanessa Testoni;Pedro Garcia Freitas","0923-5965","A2"
"Improved two-dimensional dynamic S-EMG Signal compression with robust automatic segmentation.","2021","Biomedical Signal Processing and Control","Biomed. Signal Process. Control.","Francisco Assis de Oliveira Nascimento;Marcel H. Trabuco;Bruno Macchiavello;Davi B. Gusmão;Marcus V. C. Costa","1746-8094","A1"
"S-EMG Signal Compression in One-Dimensional and Two-Dimensional Approaches.","2018","IEEE Journal of Biomedical and Health Informatics","IEEE J. Biomed. Health Informatics","Marcel H. Trabuco;Marcus V. C. Costa;Bruno Macchiavello;Francisco Assis de Oliveira Nascimento","2168-2194","A1"
"Text-dependent User Verification of Handwritten Words and Signatures on Mobile Devices.","2016","The Computer Journal","Comput. J.","Nilson Donizete Guerin Júnior;Flavio de Barros Vidal;Bruno Macchiavello","N/A","N/A"
"Loss-Resilient Coding of Texture and Depth for Free-Viewpoint Video Conferencing.","2014","IEEE Transactions on Multimedia (TMM)","IEEE Trans. Multim.","Bruno Macchiavello;Camilo C. Dorea;Edson M. Hung;Gene Cheung;Wai-Tian Tan","1520-9210","A1"
"A multi-agent model system for land-use change simulation.","2013","Environmental Modelling and Software","Environ. Model. Softw.","Célia Ghedini Ralha;Carolina G. Abreu;Cássio Giorgio Couto Coelho;Alexandre Zaghetto;Bruno Macchiavello;Ricardo B. Machado","1364-8152","A1"
"Loss-resilient Coding of Texture and Depth for Free-viewpoint Video Conferencing","2013","Computing Research Repository (CoRR)","CoRR","Bruno Macchiavello;Camilo C. Dorea;Edson M. Hung;Gene Cheung;Wai-tian Tan","N/A","N/A"
