"Title","Year","Venue","Venue Short","Authors","ISSN","Qualis CAPES"
"Formalization of the Computational Theory of a Turing Complete Functional Language Model.","2022","Journal of Automated Reasoning","J. Autom. Reason.","Thiago Mendonça Ferreira Ramos;Ariane Alves Almeida;Mauricio Ayala-Rincón","0168-7433","A2"
"Grammar Compression by Induced Suffix Sorting.","2022","ACM Journal of Experimental Algorithmics (JEA)","ACM J. Exp. Algorithmics","Daniel Saad Nogueira Nunes;Felipe A. Louza;Simon Gog;Mauricio Ayala-Rincón;Gonzalo Navarro 0001","N/A","N/A"
"The impact of formulation of cost function in Task Mapping Problem on NoCs using bio-inspired based-metaheuristics.","2022","Microprocessors and Microsystems","Microprocess. Microsystems","Jessé Barreto de Barros;Nidhi Anantharajaiah;Mauricio Ayala-Rincón;Carlos Humberto Llanos Quintero;Jürgen Becker 0001","0141-9331","C"
"Introduction to the special issue: Confluence.","2022","Mathematical Structures in Computer Science (MSCS)","Math. Struct. Comput. Sci.","Mauricio Ayala-Rincón;Samuel Mimram","0960-1295","A2"
"Proceedings 16th Logical and Semantic Frameworks with Applications, LSFA 2021, Buenos Aires, Argentina (Online), 23rd - 24th July, 2021.","2022","Computing Research Repository (CoRR)","LSFA","Mauricio Ayala-Rincón;Eduardo Bonelli","N/A","N/A"
"Reconfigurable Heterogeneous Parallel Island Models.","2022","Computing Research Repository (CoRR)","CoRR","Lucas Angelo da Silveira;Thaynara Arielly de Lima;Mauricio Ayala-Rincón","N/A","N/A"
"Formalization of Ring Theory in PVS.","2021","Journal of Automated Reasoning","J. Autom. Reason.","Thaynara Arielly de Lima;André Luiz Galdino;Andréia Borges Avelar;Mauricio Ayala-Rincón","0168-7433","A2"
"Formalising nominal C-unification generalised with protected variables.","2021","Mathematical Structures in Computer Science (MSCS)","Math. Struct. Comput. Sci.","Mauricio Ayala-Rincón;Washington de Carvalho Segundo;Maribel Fernández;Gabriel Ferreira Silva;Daniele Nantes-Sobrinho","0960-1295","A2"
"On Nominal Syntax and Permutation Fixed Points.","2020","Logical Methods in Computer Science","Log. Methods Comput. Sci.","Mauricio Ayala-Rincón;Maribel Fernández;Daniele Nantes-Sobrinho","1860-5974","B1"
"Introduction to the special issue: Unification.","2020","Mathematical Structures in Computer Science (MSCS)","Math. Struct. Comput. Sci.","Mauricio Ayala-Rincón;Philippe Balbiani","0960-1295","A2"
"Formalizing the dependency pair criterion for innermost termination.","2020","Science of Computer Programming","Sci. Comput. Program.","Ariane Alves Almeida;Mauricio Ayala-Rincón","0167-6423","A4"
"Teaching Interactive Proofs to Mathematicians.","2020","Computing Research Repository (CoRR)","ThEdu@IJCAR","Mauricio Ayala-Rincón;Thaynara Arielly de Lima","N/A","N/A"
"Grammar Compression By Induced Suffix Sorting.","2020","Computing Research Repository (CoRR)","CoRR","Daniel Saad Nogueira Nunes;Felipe A. Louza;Simon Gog;Mauricio Ayala-Rincón;Gonzalo Navarro 0001","N/A","N/A"
"Opposition-Based Memetic Algorithm and Hybrid Approach for Sorting Permutations by Reversals.","2019","Evolutionary Computation","Evol. Comput.","José Luis Soncco-Álvarez;Daniel M. Muñoz;Mauricio Ayala-Rincón","1063-6560","A1"
"Selected Extended Papers of ITP 2017 - Preface.","2019","Journal of Automated Reasoning","J. Autom. Reason.","Mauricio Ayala-Rincón;César A. Muñoz","0168-7433","A2"
"Typed path polymorphism.","2019","Theoretical Computer Science","Theor. Comput. Sci.","Mauricio Ayala-Rincón;Eduardo Bonelli;Juan Edi;Andrés Viso","0304-3975","A2"
"A formalisation of nominal α-equivalence with A, C, and AC function symbols.","2019","Theoretical Computer Science","Theor. Comput. Sci.","Mauricio Ayala-Rincón;Washington de Carvalho Segundo;Maribel Fernández;Daniele Nantes-Sobrinho;Ana Cristina Rocha Oliveira","0304-3975","A2"
"On Nominal Syntax and Permutation Fixed Points.","2019","Computing Research Repository (CoRR)","CoRR","Mauricio Ayala-Rincón;Maribel Fernández;Daniele Nantes-Sobrinho","N/A","N/A"
"Formalizing the Dependency Pair Criterion for Innermost Termination.","2019","Computing Research Repository (CoRR)","CoRR","Ariane Alves Almeida;Mauricio Ayala-Rincón","N/A","N/A"
"On the average number of reversals needed to sort signed permutations.","2018","Discrete Applied Mathematics","Discret. Appl. Math.","Thaynara A. de Lima;Mauricio Ayala-Rincón","0166-218X","A2"
"Nominal essential intersection types.","2018","Theoretical Computer Science","Theor. Comput. Sci.","Mauricio Ayala-Rincón;Maribel Fernández;Ana Cristina Rocha Oliveira;Daniel Lima Ventura","0304-3975","A2"
"A Formalisation of Nominal C-Matching through Unification with Protected Variables.","2018","Electronic Notes in Theoretical Computer Science (ENTCS)","LSFA","Mauricio Ayala-Rincón;Washington de Carvalho Segundo;Maribel Fernández;Daniele Nantes-Sobrinho","N/A","N/A"
"Confluence of Orthogonal Term Rewriting Systems in the Prototype Verification System.","2017","Journal of Automated Reasoning","J. Autom. Reason.","Ana Cristina Rocha Oliveira;André Luiz Galdino;Mauricio Ayala-Rincón","0168-7433","A2"
"Intruder deduction problem for locally stable theories with normal forms and inverses.","2017","Theoretical Computer Science","Theor. Comput. Sci.","Mauricio Ayala-Rincón;Maribel Fernández;Daniele Nantes-Sobrinho","0304-3975","A2"
"Logical and Semantic Frameworks with Applications.","2017","Theoretical Computer Science","Theor. Comput. Sci.","Mauricio Ayala-Rincón;Ian Mackie;Ugo Montanari","0304-3975","A2"
"Nominal C-Unification.","2017","Computing Research Repository (CoRR)","CoRR","Mauricio Ayala-Rincón;Washington de Carvalho Segundo;Maribel Fernández;Daniele Nantes-Sobrinho","N/A","N/A"
"A Grammar Compression Algorithm based on Induced Suffix Sorting.","2017","Computing Research Repository (CoRR)","CoRR","Daniel Saad Nogueira Nunes;Felipe A. Louza;Simon Gog;Mauricio Ayala-Rincón;Gonzalo Navarro 0001","N/A","N/A"
"A Formalisation of Nominal α-equivalence with A and AC Function Symbols.","2016","Electronic Notes in Theoretical Computer Science (ENTCS)","LSFA","Mauricio Ayala-Rincón;Washington de Carvalho Segundo;Maribel Fernández;Daniele Nantes-Sobrinho","N/A","N/A"
"Type Soundness for Path Polymorphism.","2016","Computing Research Repository (CoRR)","CoRR","Andrés Viso;Eduardo Bonelli;Mauricio Ayala-Rincón","N/A","N/A"
"Explicit substitution calculi with de Bruijn indices and intersection type systems.","2015","Logic Journal of the IGPL","Log. J. IGPL","Daniel Lima Ventura;Fairouz Kamareddine;Mauricio Ayala-Rincón","1367-0751","A1"
"Parallelization of genetic algorithms for sorting permutations by reversals over biological data.","2015","International Journal of Hybrid Intelligent Systems","Int. J. Hybrid Intell. Syst.","José Luis Soncco-Álvarez;Gabriel Marchesan Almeida;Jürgen Becker 0001;Mauricio Ayala-Rincón","1448-5869","B3"
"Formalising Confluence in PVS.","2015","Computing Research Repository (CoRR)","DCM","Mauricio Ayala-Rincón","N/A","N/A"
"Checking Overlaps of Nominal Rewriting Rules.","2015","Electronic Notes in Theoretical Computer Science (ENTCS)","LSFA","Mauricio Ayala-Rincón;Maribel Fernández;Murdoch James Gabbay;Ana Cristina Rocha Oliveira","N/A","N/A"
"Completeness in PVS of a Nominal Unification Algorithm.","2015","Electronic Notes in Theoretical Computer Science (ENTCS)","LSFA","Mauricio Ayala-Rincón;Maribel Fernández;Ana Cristina Rocha Oliveira","N/A","N/A"
"A Practical Semi-External Memory Method for Approximate Pattern Matching.","2015","Electronic Notes in Theoretical Computer Science (ENTCS)","WEIT","Daniel Saad Nogueira Nunes;Mauricio Ayala-Rincón","N/A","N/A"
"Type Soundness for Path Polymorphism.","2015","Electronic Notes in Theoretical Computer Science (ENTCS)","LSFA","Andrés Viso;Eduardo Bonelli;Mauricio Ayala-Rincón","N/A","N/A"
"Hardware opposition-based PSO applied to mobile robot controllers.","2014","Engineering Applications of Artificial Intelligence","Eng. Appl. Artif. Intell.","Daniel M. Muñoz;Carlos H. Llanos;Leandro dos Santos Coelho;Mauricio Ayala-Rincón","0952-1976","A1"
"First-order unification in the PVS proof assistant.","2014","Logic Journal of the IGPL","Log. J. IGPL","Andréia Borges Avelar;André Luiz Galdino;Flávio Leonardo Cavalcanti de Moura;Mauricio Ayala-Rincón","1367-0751","A1"
"Preface.","2014","Electronic Notes in Theoretical Computer Science (ENTCS)","LSFA","Mauricio Ayala-Rincón;Ian Mackie","N/A","N/A"
"Proceedings 9th International Workshop on Developments in Computational Models, DCM 2013, Buenos Aires, Argentina, 26 August 2013.","2014","Computing Research Repository (CoRR)","DCM","Mauricio Ayala-Rincón;Eduardo Bonelli;Ian Mackie","N/A","N/A"
"Formalization in PVS of Balancing Properties Necessary for Proving Security of the Dolev-Yao Cascade Protocol Model.","2013","Journal of Formalized Reasoning","J. Formaliz. Reason.","Mauricio Ayala-Rincón;Yuri Santos Rego","0168-7433","A2"
"A Compressed Suffix Tree Based Implementation With Low Peak Memory Usage.","2013","Electronic Notes in Theoretical Computer Science (ENTCS)","CLEI Selected Papers","Daniel Saad Nogueira Nunes;Mauricio Ayala-Rincón","N/A","N/A"
"Comparison between Digital Tone-Mapping Operators and a Focal-Plane Pixel-Parallel Circuit.","2020","Signal Processing: Image Communication","Signal Process. Image Commun.","Gustavo M. S. Nunes;Fernanda D. V. R. Oliveira;Mylène C. Q. Farias;José Gabriel Rodríguez Carneiro Gomes;Antonio Petraglia;Jorge Fernández-Berni;Ricardo Carmona-Galán;Ángel Rodríguez-Vázquez","0923-5965","A2"
"Study of Subjective and Objective Quality Assessment of Audio-Visual Signals.","2020","IEEE Transactions on Image Processing","IEEE Trans. Image Process.","Xiongkuo Min;Guangtao Zhai;Jiantao Zhou 0001;Mylène C. Q. Farias;Alan Conrad Bovik","1057-7149","A1"
"Osteoporosis screening: Leveraging EfficientNet with complete and cropped facial panoramic radiography imaging.","2025","Biomedical Signal Processing and Control","Biomed. Signal Process. Control.","Bruno Scholles Soares Dias;Raíza S. Oliveira;Paulo Tadeu de Souza Figueiredo;André Ferreira Leite;Nilce Santos Melo;Lucas Rodrigues Costa;Marcos Fagundes Caetano;Mylène C. Q. Farias","1746-8094","A1"
"SynFlowMap: A synchronized optical flow remapping for video motion magnification.","2025","Signal Processing: Image Communication","Signal Process. Image Commun.","Jonathan A. Lima;Cristiano Jacques Miosso;Mylène C. Q. Farias","0923-5965","A2"
"Impact of Alignment Edits on the Quality of Experience of 360° Videos.","2023","IEEE Access","IEEE Access","Lucas S. Althoff;Mylène C. Q. Farias;Alessandro Rodrigues e Silva;Marcelo M. Carvalho","2169-3536","A3"
"A two-stream cnn based visual quality assessment method for light field images.","2023","Multimedia Tools and Applications","Multim. Tools Appl.","Sana Alamgeer;Mylène C. Q. Farias","1380-7501","A2"
"A survey on visual quality assessment methods for light fields.","2023","Signal Processing: Image Communication","Signal Process. Image Commun.","Sana Alamgeer;Mylène C. Q. Farias","0923-5965","A2"
"Point cloud quality assessment: unifying projection, geometry, and texture similarity.","2023","The Visual Computer","Vis. Comput.","Pedro Garcia Freitas;Rafael Diniz;Mylène C. Q. Farias","0178-2789","A4"
"Point cloud quality assessment based on geometry-aware texture descriptors.","2022","Computers &#38; Graphics","Comput. Graph.","Rafael Diniz;Pedro Garcia Freitas;Mylène C. Q. Farias","0097-8493","A2"
"Towards the Effects of Alignment Edits on the Quality of Experience of 360 Videos.","2022","Computing Research Repository (CoRR)","CoRR","Lucas S. Althoff;Alessandro R. Rodrigues;Mylène C. Q. Farias","N/A","N/A"
"An Optimized Feature Selection Technique in Diversified Natural Scene Text for Classification Using Genetic Algorithm.","2021","IEEE Access","IEEE Access","Ghulam Jillani Ansari;Jamal Hussain Shah;Mylène C. Q. Farias;Muhammad Sharif 0001;Nauman Qadeer;Habib Ullah Khan","2169-3536","A3"
"CNN-based no-reference video quality assessment method using a spatiotemporal saliency patch selection procedure.","2021","Journal of Electronic Imaging","J. Electronic Imaging","Sana Alamgeer;Muhammad Irshad;Mylène C. Q. Farias","1017-9909","A4"
"Color and Geometry Texture Descriptors for Point-Cloud Quality Assessment.","2021","IEEE Signal Processing Letters","IEEE Signal Process. Lett.","Rafael Diniz;Pedro Garcia Freitas;Mylène C. Q. Farias","1070-9908","A1"
"Enlaces de rádio de longa distância utilizando a banda de HF.","2021","Computing Research Repository (CoRR)","CoRR","Rafael Diniz;Mylène C. Q. Farias","N/A","N/A"
"UnB-AV: An Audio-Visual Database for Multimedia Quality Research.","2020","IEEE Access","IEEE Access","Helard Becerra Martinez;Andrew Hines;Mylène C. Q. Farias","2169-3536","A3"
"Perceptual quality assessment of 3D videos with stereoscopic degradations.","2020","Multimedia Tools and Applications","Multim. Tools Appl.","Alessandro Rodrigues e Silva;Mylène C. Q. Farias","1380-7501","A2"
"Isotropic and anisotropic filtering norm-minimization: A generalization of the TV and TGV minimizations using NESTA.","2020","Signal Processing: Image Communication","Signal Process. Image Commun.","Jonathan A. Lima;Felipe Batista da Silva;Ricardo von Borries;Cristiano Jacques Miosso;Mylène C. Q. Farias","0923-5965","A2"
"Image quality assessment using BSIF, CLBP, LCP, and LPQ operators.","2020","Theoretical Computer Science","Theor. Comput. Sci.","Pedro Garcia Freitas;Luísa Peixoto da Eira;Samuel Soares Santos;Mylène C. Q. Farias","0304-3975","A2"
"NAViDAd: A No-Reference Audio-Visual Quality Metric Based on a Deep Autoencoder.","2020","Computing Research Repository (CoRR)","CoRR","Helard Becerra Martinez;Mylène C. Q. Farias;Andrew Hines","N/A","N/A"
"How deep is your encoder: an analysis of features descriptors for an autoencoder-based audio-visual quality metric.","2020","Computing Research Repository (CoRR)","CoRR","Helard Becerra Martinez;Andrew Hines;Mylène C. Q. Farias","N/A","N/A"
"A (2, 2) XOR-based visual cryptography scheme without pixel expansion.","2019","Journal of Visual Communication and Image Representation","J. Vis. Commun. Image Represent.","Max E. Vizcarra Melgar;Mylène C. Q. Farias","1047-3203","A1"
"High density two-dimensional color code.","2019","Multimedia Tools and Applications","Multim. Tools Appl.","Max E. Vizcarra Melgar;Mylène C. Q. Farias","1380-7501","A2"
"A framework for computationally efficient video quality assessment.","2019","Signal Processing: Image Communication","Signal Process. Image Commun.","Welington Y. L. Akamine;Pedro Garcia Freitas;Mylène C. Q. Farias","0923-5965","A2"
"Bio-inspired optimization algorithms for real underwater image restoration.","2019","Signal Processing: Image Communication","Signal Process. Image Commun.","Camilo Sánchez-Ferreira;Leandro dos Santos Coelho;Helon V. H. Ayala;Mylène C. Q. Farias;Carlos H. Llanos","0923-5965","A2"
"A Taxonomy and Dataset for 360° Videos.","2019","CoRR","CoRR","Afshin Taghavi Nasrabadi;Aliehsan Samiei;Anahita Mahzari;Mylène C. Q. Farias;Marcelo M. Carvalho;Ryan P. McMahan;Ravi Prakash 0001","N/A","N/A"
"Referenceless image quality assessment by saliency, color-texture energy, and gradient boosting machines.","2018","J. Braz. Comput. Soc.","J. Braz. Comput. Soc.","Pedro Garcia Freitas;Welington Y. L. Akamine;Mylène C. Q. Farias","N/A","N/A"
"Performance analysis of a video quality ruler methodology for subjective quality assessment.","2018","J. Electronic Imaging","J. Electronic Imaging","Pedro Garcia Freitas;Alexandre F. Silva;Judith A. Redi;Mylène C. Q. Farias","1017-9909","A4"
"Using perceptual strength estimates to predict the perceived annoyance of videos with combinations of spatial and temporal artifacts.","2018","J. Electronic Imaging","J. Electronic Imaging","Alexandre F. Silva;Mylène C. Q. Farias","1017-9909","A4"
"On the Application LBP Texture Descriptors and Its Variants for No-Reference Image Quality Assessment.","2018","J. Imaging","J. Imaging","Pedro Garcia Freitas;Luísa Peixoto da Eira;Samuel Soares Santos;Mylène Christine Queiroz de Farias","N/A","N/A"
"Combining audio and video metrics to assess audio-visual quality.","2018","Multim. Tools Appl.","Multim. Tools Appl.","Helard Becerra Martinez;Mylène C. Q. Farias","N/A","N/A"
"Using multiple spatio-temporal features to estimate video quality.","2018","Signal Process. Image Commun.","Signal Process. Image Commun.","Pedro Garcia Freitas;Welington Y. L. Akamine;Mylène C. Q. Farias","0923-5965","A2"
"No-Reference Image Quality Assessment Using Orthogonal Color Planes Patterns.","2018","IEEE Trans. Multim.","IEEE Trans. Multim.","Pedro Garcia Freitas;Welington Y. L. Akamine;Mylène C. Q. Farias","N/A","N/A"
"Per-pixel mirror-based method for high-speed video acquisition.","2017","J. Vis. Commun. Image Represent.","J. Vis. Commun. Image Represent.","Jonathan A. Lima;Cristiano Jacques Miosso;Mylène C. Q. Farias","N/A","N/A"
"Detecting tampering in audio-visual content using QIM watermarking.","2016","Inf. Sci.","Inf. Sci.","Ronaldo Rigoni;Pedro Garcia Freitas;Mylène C. Q. Farias","N/A","N/A"
"Secure self-recovery watermarking scheme for error concealment and tampering detection.","2016","J. Braz. Comput. Soc.","J. Braz. Comput. Soc.","Pedro Garcia Freitas;Ronaldo Rigoni;Mylène C. Q. Farias","N/A","N/A"
"Recent developments in visual quality monitoring by key performance indicators.","2016","Multim. Tools Appl.","Multim. Tools Appl.","Mikolaj Leszczuk;Mateusz Hanusiak;Mylène C. Q. Farias;Emmanuel Wyckens;George Heston","N/A","N/A"
"Hiding color watermarks in halftone images using maximum-similarity binary patterns.","2016","Signal Process. Image Commun.","Signal Process. Image Commun.","Pedro Garcia Freitas;Mylène C. Q. Farias;Aletéia P. F. Araújo","0923-5965","A2"
"Enhancing inverse halftoning via coupled dictionary training.","2016","Signal Process. Image Commun.","Signal Process. Image Commun.","Pedro Garcia Freitas;Mylène C. Q. Farias;Aletéia P. F. Araújo","0923-5965","A2"
"Perceptual Annoyance Models for Videos With Combinations of Spatial and Temporal Artifacts.","2016","IEEE Trans. Multim.","IEEE Trans. Multim.","Alexandre F. Silva;Mylène C. Q. Farias;Judith A. Redi","N/A","N/A"
"Video quality assessment using visual attention computational models.","2014","J. Electronic Imaging","J. Electronic Imaging","Welington Y. L. Akamine;Mylène C. Q. Farias","1017-9909","A4"
"Full-reference audio-visual video quality metric.","2014","J. Electronic Imaging","J. Electronic Imaging","Helard Becerra Martinez;Mylène C. Q. Farias","1017-9909","A4"
"A fire management intelligent system for the Brazilian cerrado biome based on a deep learning two phase detection method.","2025","Journal on Reliable Intelligent Environments","J. Reliab. Intell. Environ.","Natalia O. Borges;Lívia G. C. Fonseca;Priscila Solís Barreto;Eduardo Alchieri;Marcos Fagundes Caetano;Paulo Angelo A. Resende;Leonardo Brandão;Lucas Vieira","2199-4676","A3"
"Age of information optimization in cyber-physical systems with stateful packet management techniques.","2024","Ad Hoc Networks","Ad Hoc Networks","Paulo César Prandel;Priscila Solís Barreto","1570-8705","A1"
"Forest fire monitoring system supported by unmanned aerial vehicles and edge computing: a performance evaluation using petri nets.","2024","Cluster Computing","Clust. Comput.","Arthur Sabino;Luiz Nelson Lima;Carlos Brito 0001;Leonel Feitosa;Marcos F. Caetano;Priscila Solís Barreto;Francisco Airton Silva","1386-7857","A2"
"5G-RCOLAB: A system level simulator for 5G and beyond in rural areas.","2023","Computer Communications","Comput. Commun.","Gabriel de Carvalho Ferreira;Priscila Solís Barreto;Marcos F. Caetano;Eduardo Alchieri;Daniel Costa Araújo 0001;Francisco Rodrigo P. Cavalcanti;Diego Aguiar Sousa","0140-3664","A2"
"A Risk Perception Indicator to Evaluate the Migration of Government Legacy Systems to the Cloud.","2021","International Journal of Information Systems in the Service Sector (IJISSS)","Int. J. Inf. Syst. Serv. Sect.","Breno G. S. Costa;Priscila Solís Barreto","N/A","N/A"
"Enhanced Remote Areas Communications: The Missing Scenario for 5G and Beyond 5G Networks.","2020","IEEE Access","IEEE Access","Luciano Leonel Mendes;Carlos Sallé Moreno;Maria Valéria Marquezini;André Mendes Cavalcante;Peter Neuhaus;Jorge Seki;Nathália Figueiredo Tinoco Aniceto;Heikki Karvonen;Iván Vidal;Francisco Valera;Priscila América Solís Mendez Barreto;Marcos Fagundes Caetano;Wheberth Damascena Dias;Gerhard P. Fettweis","2169-3536","A3"
"Building secure protocols for extensible distributed coordination through secure extensions.","2019","Computers &#38; Security","Comput. Secur.","Edson Floriano;Eduardo Alchieri;Diego F. Aranha;Priscila Solís Barreto","0167-4048","A1"
"Device-Based Security to Improve User Privacy in the Internet of Things †.","2018","Sensors","Sensors","Luís Alberto Belém Pacheco;Eduardo Adílio Pelinson Alchieri;Priscila América Solís Mendez Barreto","N/A","N/A"
"Providing privacy on the tuple space model.","2017","Journal of Internet Services and Applications","J. Internet Serv. Appl.","Edson Floriano;Eduardo Alchieri;Diego F. Aranha;Priscila Solís","1867-4828","A2"
"An online database for einkorn wheat to aid in gene discovery and functional genomics studies.","2023","Database - The Journal of Biological Databases and Curation","Database J. Biol. Databases Curation","Parva Kumar Sharma;Hanin Ibrahim Ahmed;Matthias Heuberger;Dal-Hoe Koo;Jesus Quiroz-Chavez;Laxman Adhikari;John Raupp;Stéphane Cauet;Nathalie Rodde;Charlotte Cravero;Caroline Callot;Inderjit Singh Yadav;Nagarajan Kathiresan;Naveenkumar Athiyannan;Ricardo H. Ramirez-Gonzalez;Cristobal Uauy;Thomas Wicker;Michael Abrouk;Yong Q. Gu;Jesse Poland;Simon G. Krattinger;Gerard R. Lazo;Vijay K. Tiwari","1758-0463","A1"
"Three-Stage Power Supply System Model for a Wearable IoT Device for COVID-19 Patients.","2023","IEEE Embedded Systems Letters","IEEE Embed. Syst. Lett.","Ricardo Álvarez-González;Edgar R. González-Campos;Nicolás Quiroz-Hernández;Alba Maribel Sánchez Gálvez","1943-0663","A2"
"System identification for T1D via artificial intelligence algorithms: Evolutionary or swarm.","2023","Biomedical Signal Processing and Control","Biomed. Signal Process. Control.","Claudia Patricia Flores-Gutiérrez;Griselda Quiroz-Compeán;Octavio I. Renteria-Vidales;Luis M. Torres-Treviño;Eduardo Ruiz-Velázquez;Ricardo Femat","1746-8094","A1"
"Artificial intelligence applied to analyzes during the pandemic: COVID-19 beds occupancy in the state of Rio Grande do Norte, Brazil.","2023","Frontiers in Artificial Intelligence","Frontiers Artif. Intell.","Tiago de Oliveira Barreto;Nícolas Vinícius Rodrigues Veras;Pablo Holanda Cardoso;Felipe Ricardo dos Santos Fernandes;Luiz Paulo de Souza Medeiros;Maria Valéria Bezerra;Filomena Marques Queiroz de Andrade;Chander de Oliveira Pinheiro;Ignacio Sánchez-Gendriz;Gleyson José Pinheiro Caldeira Silva;Leandro Farias Rodrigues;Antonio Higor Freire de Morais;João Paulo Queiroz dos Santos;Jailton Carlos Paiva;Íon Garcia Mascarenhas de Andrade;Ricardo Alexsandro de Medeiros Valentim","2192-6352","A3"
"Comparison between Digital Tone-Mapping Operators and a Focal-Plane Pixel-Parallel Circuit.","2020","Signal Processing: Image Communication","Signal Process. Image Commun.","Gustavo M. S. Nunes;Fernanda D. V. R. Oliveira;Mylène C. Q. Farias;José Gabriel Rodríguez Carneiro Gomes;Antonio Petraglia;Jorge Fernández-Berni;Ricardo Carmona-Galán;Ángel Rodríguez-Vázquez","0923-5965","A2"
"Digital dual test syphilis/HIV detection based on Fourier Descriptors of Cyclic Voltammetry curves.","2024","Computers in Biology and Medicine","Comput. Biol. Medicine","Ignacio Sánchez-Gendriz;Dionísio D. A. Carvalho;Leonardo J. Galvão-Lima;Ana Isabela L. Sales-Moioli;Talita K. de B. Pinto;Felipe Ricardo dos Santos Fernandes;Jorge Henriques;Thaisa S. Lima;Luiz Affonso Guedes;Agnaldo S. Cruz;Antonio Higor Freire de Morais;João Paulo Queiroz dos Santos;Ernano Arrais;Karilany Dantas Coutinho;Guilherme Medeiros Machado;Aliete Cunha-Oliveira;Catarina Alexandra dos Reis Vale Gomes;Ricardo Alexsandro de Medeiros Valentim","0010-4825","A2"
"Surveying Emerging Network Approaches for Military Command and Control Systems.","2024","ACM Computing Surveys","ACM Comput. Surv.","João Eduardo Costa Gomes;Ricardo Rodrigues Ehlert;Rodrigo Murillo Boesche;Vinicius Santosde Lima;Jorgito Matiuzzi Stocchero;Dante A. C. Barone;Juliano Araujo Wickboldt;Edison Pignaton de Freitas;Julio C. S. dos Anjos;Ricardo Queiroz de Araujo Fernandes","0360-0300","A1"
"DODFMiner: An automated tool for Named Entity Recognition from Official Gazettes.","2024","Neurocomputing","Neurocomputing","Gabriel M. C. Guimarães;Felipe X. B. da Silva;Andrei L. Queiroz;Ricardo M. Marcacini;Thiago de Paulo Faleiros;Vinicius R. P. Borges;Luís P. F. Garcia","N/A","N/A"
"Next-generation antivirus for JavaScript malware detection based on dynamic features.","2024","Knowledge and Information Systems (KAIS)","Knowl. Inf. Syst.","Sidney M. L. de Lima;Danilo Souza;Ricardo Pinheiro;Sthéfano Henrique Mendes Tavares Silva;Petrônio Lopes;Rafael Lima;Jemerson Oliveira;Thyago de Amorim Monteiro;Sérgio M. M. Fernandes;Edison de Queiroz Albuquerque;Washington Wagner Azevedo da Silva;Wellington P. dos Santos","0219-1377","A2"
"A Driver-Vehicle Model for ADS Scenario-Based Testing.","2024","IEEE Transactions on Intelligent Transportation Systems","IEEE Trans. Intell. Transp. Syst.","Rodrigo Queiroz;Divit Sharma;Ricardo Caldas;Krzysztof Czarnecki 0001;Sergio García 0002;Thorsten Berger;Patrizio Pelliccione","1524-9050","A1"
