"Title","Year","Venue","Venue Short","Authors","ISSN","Qualis CAPES"
"Assistive typing technologies: a new method based on binary sequences.","2022","International Journal of Computer Applications in Technology (IJCAT)","Int. J. Comput. Appl. Technol.","Luiz Augusto F. Dantas Da Costa;Rodrigo Bonacin;Rodolfo Ipolito Meneguette;Geraldo Pereira Rocha Filho;Vinícius P. Gonçalves 0001","0952-8091","A4"
"Multi-label legal text classification with BiLSTM and attention.","2022","International Journal of Computer Applications in Technology (IJCAT)","Int. J. Comput. Appl. Technol.","Liriam Enamoto;Alan R. Santos;Ricardo Maia;Weigang Li 0001;Geraldo P. Rocha Filho","0952-8091","A4"
"STRAYER: A Smart Grid adapted automation architecture against cyberattacks.","2022","Journal of Information Security and Applications","J. Inf. Secur. Appl.","Alexandro de O. Paula;Rodolfo I. Meneguette;Felipe T. Giuntini;Maycon L. M. Peixoto;Vinícius P. Gonçalves 0001;Geraldo P. Rocha Filho","0022-3239","A2"
"HOsT: Towards a Low-Cost Fog Solution via Smart Objects to Deal with the Heterogeneity of Data in a Residential Environment.","2022","Sensors","Sensors","Geraldo P. Rocha Filho;Artur H. Brandão de Souza;Renato A. Nobre;Rodolfo I. Meneguette;Heitor Freitas;Vinícius P. Gonçalves 0001","N/A","N/A"
"Optimized Solutions for Deploying a Militarized 4G/LTE Network With Maximum Coverage and Minimum Interference.","2022","IEEE Transactions on Network and Service Management","IEEE Trans. Netw. Serv. Manag.","Emerson de O. Antunes;Marcos F. Caetano;Marcelo Antonio Marotta;Aletéia P. F. Araújo;Lucas Bondan;Rodolfo I. Meneguette;Geraldo P. Rocha Filho","1932-4537","A1"
"FlexPersonas: flexible design of IoT-based home healthcare systems targeted at the older adults.","2021","AI &#38; Society","AI Soc.","Vinícius P. Gonçalves 0001;Geraldo P. R. Filho;Leandro Y. Mano;Rodrigo Bonacin","0951-5666","A1"
"A fog-enabled smart home solution for decision-making using smart objects.","2020","Future Generation Computer Systems","Future Gener. Comput. Syst.","Geraldo P. Rocha Filho;Rodolfo I. Meneguette;Guilherme Maia;Gustavo Pessin;Vinícius P. Gonçalves 0001;Li Weigang 0001;Jó Ueyama;Leandro A. Villas","0167-739X","A1"
"Energy-efficient smart home systems: Infrastructure and decision-making process.","2019","Internet of Things","Internet Things","Geraldo P. R. Filho;Leandro A. Villas;Vinícius P. Gonçalves 0001;Gustavo Pessin;Antonio A. F. Loureiro;Jó Ueyama","2542-6605","B1"
"Towards a Fog-Enabled Intelligent Transportation System to Reduce Traffic Jam.","2019","Sensors","Sensors","Celso A. R. L. Brennand;Geraldo P. Rocha Filho;Guilherme Maia;Felipe D. da Cunha;Daniel L. Guidoni;Leandro A. Villas","N/A","N/A"
"Fine-Tuning of UAV Control Rules for Spraying Pesticides on Crop Fields: An Approach for Dynamic Environments.","2016","International Journal on Artificial Intelligence Tools (IJAIT)","Int. J. Artif. Intell. Tools","Bruno S. Faiçal;Gustavo Pessin;Geraldo P. R. Filho;André Carlos Ponce de Leon Ferreira de Carvalho;Pedro Henrique Gomes;Jó Ueyama","0218-2130","B1"
"Investigation on the evolution of a robotic controller for autonomous vehicle navigation.","2014","Journal of Intelligent and Fuzzy Systems","J. Intell. Fuzzy Syst.","Gustavo Pessin;Jefferson R. Souza;Fernando Santos Osório;Bruno S. Faiçal;Geraldo P. R. Filho;Jó Ueyama;Patrícia A. Vargas;Denis Fernando Wolf","1064-1246","A2"
"Energy management in smart grids: An Edge-Cloud Continuum approach with Deep Q-learning.","2025","Future Generation Computer Systems","Future Gener. Comput. Syst.","Eric Bernardes Chagas Barros;Wesley O. Souza;Daniel G. Costa;Geraldo P. R. Filho;Gustavo B. Figueiredo;Maycon Leone Maciel Peixoto","0167-739X","A1"
"Empowering few-shot learning: a multimodal optimization framework.","2025","Neural Computing and Applications","Neural Comput. Appl.","Liriam Enamoto;Geraldo Pereira Rocha Filho;Weigang Li 0001","0941-0643","A2"
"ChaSAM: An Architecture Based on Perceptual Hashing for Image Detection in Computer Forensics.","2024","IEEE Access","IEEE Access","Hericson Dos Santos;Tiago Dos Santos Martins;Jorge Andre Domingues Barreto;Luis Hideo Vasconcelos Nakamura;Caetano Mazzoni Ranieri;Robson E. De Grande;Geraldo P. Rocha Filho;Rodolfo I. Meneguette","2169-3536","A3"
"Navigating Market Sentiments: A Novel Approach to Iron Ore Price Forecasting with Weighted Fuzzy Time Series.","2024","Information","Inf.","Flavio Mauricio da Cunha Souza;Geraldo Pereira Rocha Filho;Frederico Gadelha Guimarães;Rodolfo I. Meneguette;Gustavo Pessin","2078-2489","C"
"MEDAVET: Traffic Vehicle Anomaly Detection Mechanism based on spatial and temporal structures in vehicle traffic.","2024","Journal of Internet Services and Applications","J. Internet Serv. Appl.","Ana Rosalía Huamán Reyna;Alex Josué Flórez Farfán;Geraldo P. Rocha Filho;Sandra Sampaio;Robson E. De Grande;Luis Hideo Vasconcelos Nakamura;Rodolfo Ipolito Meneguette","1867-4828","A2"
"Coarsening Algorithm Based on Multi-Label Propagation for Knowledge Discovery in Bipartite Networks.","2024","IEEE Transactions on Network Science and Engineering","IEEE Trans. Netw. Sci. Eng.","Alan Demétrius Baria Valejo;Paulo Eduardo Althoff;Thiago de Paulo Faleiros;Geraldo Pereira Rocha Filho;Yu-tao Zhu;Jianglong Yan;Weiguang Liu;Liang Zhao 0001","2327-4697","A1"
"HARMONIC: Shapley values in market games for resource allocation in vehicular clouds.","2023","Ad Hoc Networks","Ad Hoc Networks","Aguimar Ribeiro Júnior;Joahannes B. D. da Costa;Geraldo P. Rocha Filho;Leandro A. Villas;Daniel L. Guidoni;Sandra Sampaio;Rodolfo I. Meneguette","1570-8705","A1"
"A Data-Driven Soft Sensor for Mass Flow Estimation.","2023","IEEE Transactions on Instrumentation and Measurement","IEEE Trans. Instrum. Meas.","Sandro G. A. Sobreira;Pedro Henrique Gomes;Geraldo P. Rocha Filho;Gustavo Pessin","0018-9456","A1"
"MEDAVET: Traffic Vehicle Anomaly Detection Mechanism based on spatial and temporal structures in vehicle traffic.","2023","Computing Research Repository (CoRR)","CoRR","Ana Rosalía Huamán Reyna;Alex Josué Flórez Farfán;Geraldo Pereira Rocha Filho;Sandra Sampaio;Robson E. De Grande;Luis Hideo Vasconcelos Nakamura;Rodolfo Ipolito Meneguette","N/A","N/A"
"Toward an Efficient Data Dissemination Protocol for Vehicular Ad-Hoc Networks.","2022","IEEE Access","IEEE Access","Daniel L. Guidoni;Euclydes N. Gottsfritz;Rodolfo I. Meneguette;Cristiano M. Silva;Geraldo P. Rocha Filho;Fernanda Sumika H. Souza","2169-3536","A3"
"New directions for artificial intelligence: human, machine, biological, and quantum intelligence.","2022","Frontiers of Information Technology &#38; Electronic Engineering","Frontiers Inf. Technol. Electron. Eng.","Weigang Li 0001;Liriam Enamoto;Denise Leyi Li;Geraldo Pereira Rocha Filho","2095-9230","A4"
"AURORA: an autonomous agent-oriented hybrid trading service.","2022","Neural Computing and Applications","Neural Comput. Appl.","Renato A. Nobre;Khalil C. do Nascimento;Patrícia A. Vargas;Alan Demétrius Baria Valejo;Gustavo Pessin;Leandro A. Villas;Geraldo P. Rocha Filho","0941-0643","A2"
"Generic framework for multilingual short text categorization using convolutional neural network.","2021","Multimedia Tools and Applications","Multim. Tools Appl.","Liriam Enamoto;Li Weigang 0001;Geraldo P. Rocha Filho","1380-7501","A2"
"Swarm Robotics: A Perspective on the Latest Reviewed Concepts and Applications.","2021","Sensors","Sensors","Pollyanna G. Faria Dias;Mateus C. Silva;Geraldo P. Rocha Filho;Patrícia A. Vargas;Luciano Perdigão Cota;Gustavo Pessin","N/A","N/A"
"FORESAM - FOG Paradigm-Based Resource Allocation Mechanism for Vehicular Clouds.","2021","Sensors","Sensors","Rickson Simioni Pereira;Azzedine Boukerche;Marco A. C. da Silva;Luis Hideo Vasconcelos Nakamura;Heitor Freitas;Geraldo P. Rocha Filho;Rodolfo I. Meneguette","N/A","N/A"
"Watershed of Artificial Intelligence: Human Intelligence, Machine Intelligence, and Biological Intelligence.","2021","Computing Research Repository (CoRR)","CoRR","Weigang Li 0001;Liriam Enamoto;Denise Leyi Li;Geraldo Pereira Rocha Filho","N/A","N/A"
"Enhancing intelligence in traffic management systems to aid in vehicle traffic congestion problems in smart cities.","2020","Ad Hoc Networks","Ad Hoc Networks","Geraldo P. Rocha Filho;Rodolfo I. Meneguette;José Rodrigues Torres Neto;Alan Valejo;Li Weigang 0001;Jó Ueyama;Gustavo Pessin;Leandro A. Villas","1570-8705","A1"
"ITSMEI: An intelligent transport system for monitoring traffic and event information.","2020","International Journal of Distributed Sensor Networks","Int. J. Distributed Sens. Networks","Matheus Sanches Quessada;Rickson Simioni Pereira;William Revejes;Bruno Sartori;Euclydes N. Gottsfritz;Douglas D. Lieira;Marco A. C. da Silva;Geraldo P. Rocha Filho;Rodolfo I. Meneguette","1550-1329","A2"
"Automated recognition of lung diseases in CT images based on the optimum-path forest classifier.","2019","Neural Computing and Applications","Neural Comput. Appl.","Pedro Pedrosa Rebouças Filho;Antônio Carlos da Silva Barros;Geraldo L. B. Ramalho;Clayton R. Pereira;João Paulo Papa;Victor Hugo C. de Albuquerque;João Manuel R. S. Tavares","0941-0643","A2"
"Exploiting Offloading in IoT-Based Microfog: Experiments with Face Recognition and Fall Detection.","2019","Wireless Communications and Mobile Computing","Wirel. Commun. Mob. Comput.","José Rodrigues Torres Neto;Geraldo P. R. Filho;Leandro Y. Mano;Leandro A. Villas;Jó Ueyama","1530-8677","A3"
"Computação Urbana da Teoria à Prática: Fundamentos, Aplicações e Desafios.","2019","Computing Research Repository (CoRR)","CoRR","Diego O. Rodrigues;Frances Albert Santos;Geraldo P. Rocha Filho;Ademar Takeo Akabane;Raquel Cabral;Roger Immich;Wellington Lobato Jr.;Felipe D. da Cunha;Daniel L. Guidoni;Thiago Henrique Silva;Denis do Rosário;Eduardo Cerqueira;Antonio A. F. Loureiro;Leandro A. Villas","N/A","N/A"
"ResiDI: Towards a smarter smart home system for decision-making using wireless sensors and actuators.","2018","Computer Networks","Comput. Networks","Geraldo P. R. Filho;Leandro A. Villas;Heitor Freitas;Alan Valejo;Daniel L. Guidoni;Jó Ueyama","1389-1286","A1"
"Multilevel approach for combinatorial optimization in bipartite network.","2018","Knowledge-Based Systems","Knowl. Based Syst.","Alan Valejo;Maria Cristina Ferreira de Oliveira;Geraldo P. R. Filho;Alneu de Andrade Lopes","0950-7051","A1"
"How to Improve Fault Tolerance in Disaster Predictions: A Case Study about Flash Floods Using IoT, ML and Real Data.","2018","Sensors","Sensors","Gustavo Furquim;Geraldo P. R. Filho;Roozbeh Jalali;Gustavo Pessin;Richard W. Pazzi;Jó Ueyama","N/A","N/A"
"Exploiting IoT technologies for enhancing Health Smart Homes through patient identification and emotion recognition.","2016","Computer Communications","Comput. Commun.","Leandro Y. Mano;Bruno S. Faiçal;Luis Hideo Vasconcelos Nakamura;Pedro Henrique Gomes;Giampaolo L. Libralon;Rodolfo I. Meneguette;Geraldo P. R. Filho;Gabriel T. Giancristofaro;Gustavo Pessin;Bhaskar Krishnamachari;Jó Ueyama","0140-3664","A2"
"Exploiting the use of unmanned aerial vehicles to provide resilience in wireless sensor networks.","2014","IEEE Commun. Mag.","IEEE Commun. Mag.","Jo Ueyama;Heitor Freitas;Bruno S. Faiçal;Geraldo P. R. Filho;Pedro H. Fini;Gustavo Pessin;Pedro Henrique Gomes;Leandro A. Villas","N/A","N/A"
"Correlating drug prescriptions with prognosis in severe COVID-19: first step towards resource management.","2022","BMC Medical Informatics Decis. Mak.","BMC Medical Informatics Decis. Mak.","Anna S. Levin;Maristela P. Freire;Maura Salaroli de Oliveira;Ana Catharina S. Nastri;Leila S. Harima;Lauro Vieira Perdigão-Neto;Marcello M. Magri;Gabriel Fialkovitz;Pedro H. M. F. Figueiredo;Rinaldo Focaccia Siciliano;Ester C. Sabino;Danilo P. N. Carlotti;Davi Silva Rodrigues;Fátima L. S. Nunes;João Eduardo Ferreira;Geraldo Busatto Filho;Eloisa Bonfá;Edivaldo Utiyama;Aluisio Segurado;Beatriz Perondi;Anna M. Morais;Amanda Montal;Solange Fusco;Marjorie Fregonesi;Marcelo Rocha;Izabel Marcilio;Izabel C. Rios;Fabiane;Y. O. Kawano;M. Amelia de Jesus;Esper G. Kallas;Carolina Marmo;Clarice Tanaka;Heraldo P. de Souza;Julio F. M. Marchini;Carlos Carvalho;Juliana C. Ferreira;Thais Guimaraes;Carolina S. Lazari;Alberto J. S. Duarte;M. Cristina Braido;P. B. Francisco;Silvia F. Costa","N/A","N/A"
"Network sensor location problem with monitored lanes: Branch-and-cut and clustering search solution techniques.","2020","Comput. Ind. Eng.","Comput. Ind. Eng.","Victor Hugo Souza de Abreu;Pedro Henrique González 0001;Geraldo Regis Mauri;Glaydston Mattos Ribeiro;Romulo Dante Orrico Filho;Nilo Flavio Rosa Campos Júnior;Carlos Alberto Abramides","N/A","N/A"
"New approaches for the traffic counting location problem.","2019","Expert Syst. Appl.","Expert Syst. Appl.","Pedro Henrique González 0001;Glaubos Clímaco;Geraldo Regis Mauri;Bruno Salezze Vieira;Glaydston Mattos Ribeiro;Romulo Dante Orrico Filho;Luidi Simonetti;Leonardo Roberto Perim;Ivone Catarina Simões Hoffmann","N/A","N/A"
"Exploring the potential of structure-based deep learning approaches for T cell receptor design.","2024","PLoS Comput. Biol.","PLoS Comput. Biol.","Helder Veras Ribeiro filho;Gabriel Ernesto Jara;João Victor da Silva Guerra;Melyssa Cheung;Nathaniel R. Felbinger;José Geraldo de Carvalho Pereira;Brian G. Pierce;Paulo Sérgio Lopes-de-Oliveira","N/A","N/A"
"Wireless and Optical Convergent Access Technologies Toward 6G.","2023","IEEE Access","IEEE Access","Hugo Rodrigues Dias Filgueiras;Eduardo Saia Lima;Matheus Sêda Borsato Cunha;Celso Henrique De Souza Lopes;Letícia Carneiro de Souza;Ramon Maia Borges;Luiz Augusto Melo Pereira;Tiago Henrique Brandão;Tomás Powell Villena Andrade;Luciano Camilo Alexandre;Geraldo Neto;Agostinho Linhares;Luciano Leonel Mendes;Murilo Araújo Romero;Arismar Cerqueira Sodré","2169-3536","A3"
"KVFinder-web: a web-based application for detecting and characterizing biomolecular cavities.","2023","Nucleic Acids Res.","Nucleic Acids Res.","João Victor da Silva Guerra;Helder Veras Ribeiro filho;José Geraldo de Carvalho Pereira;Paulo Sérgio Lopes-de-Oliveira","0305-1048","A1"
"Optimization of Unmanned Air Vehicle Tactical Formation in War Games.","2022","IEEE Access","IEEE Access","Geraldo Mulato De Lima Filho;Andre Rossi Kuroswiski;Felipe Leonardo Lôbo Medeiros;Mark Voskuijl;Herman Monsuur;Angelo Passaro","2169-3536","A3"
"Discovery of New Zika Protease and Polymerase Inhibitors through the Open Science Collaboration Project OpenZika.","2022","J. Chem. Inf. Model.","J. Chem. Inf. Model.","Melina Mottin;Bruna Katiele de Paula Sousa;Nathalya Cristina de Moraes Roso Mesquita;Ketllyn Irene Zagato de Oliveira;Gabriela Dias Noske;Geraldo Rodrigues Sartori;Aline Albuquerque;Fabio Urbina;Ana C. Puhl;José Teófilo Moreira-Filho;Guilherme E. Souza;Rafael V. C. Guido;Eugene N. Muratov;Bruno Junior Neves;João Herminio Martins Da Silva;Alex E. Clark;Jair L. Siqueira-Neto;Alexander L. Perryman;Glaucius Oliva;Sean Ekins;Carolina Horta Andrade","N/A","N/A"
"pyKVFinder: an efficient and integrable Python package for biomolecular cavity detection and characterization in data science.","2021","BMC Bioinform.","BMC Bioinform.","João Victor da Silva Guerra;Helder Veras Ribeiro filho;Gabriel Ernesto Jara;Leandro Oliveira Bortot;José Geraldo de Carvalho Pereira;Paulo Sérgio Lopes-de-Oliveira","1471-2105","A1"
"ParKVFinder: A thread-level parallel approach in biomolecular cavity detection.","2020","SoftwareX","SoftwareX","João Victor da Silva Guerra;Helder Veras Ribeiro filho;Leandro Oliveira Bortot;Rodrigo Vargas Honorato;José Geraldo de Carvalho Pereira;Paulo Sérgio Lopes-de-Oliveira","2352-7110","A4"
"The Superiority of Tsallis Entropy over Traditional Cost Functions for Brain MRI and SPECT Registration.","2014","Entropy","Entropy","Henrique Tomaz Amaral-Silva;Lauro Wichert-Ana;Luiz Otávio Murta;Larissa Romualdo-Suzuki;Emerson Itikawa;Geraldo Filho Bussato;Paulo M. Azevedo-Marques","N/A","N/A"
"DDoS attack detection in SDN: Enhancing entropy-based detection with machine learning.","2024","Concurrency and Computation: Practice and Experience","Concurr. Comput. Pract. Exp.","Marcos J. Santos-Neto;Jacir Luiz Bordim;Eduardo A. P. Alchieri;Edison Ishikawa","1096-9128","A3"
"Predicting consecutive spectrum opportunities with hidden Markov models.","2023","Concurrency and Computation: Practice and Experience","Concurr. Comput. Pract. Exp.","Rodrigo F. Bezerra;Jacir Luiz Bordim","1096-9128","A3"
"DataPlane-ML: An integrated attack detection and mitigation solution for software defined networks.","2023","Concurrency and Computation: Practice and Experience","Concurr. Comput. Pract. Exp.","Ranyelson Neres Carvalho;Lucas Rodrigues Costa;Jacir Luiz Bordim;Eduardo A. P. Alchieri","1096-9128","A3"
"Mitigating message dissemination issues in safety applications for vehicular ad hoc networks.","2023","Concurrency and Computation: Practice and Experience","Concurr. Comput. Pract. Exp.","Paulo V. G. Farias;Tulio A. Lima;Jacir Luiz Bordim","1096-9128","A3"
"A full-duplex MAC technique to improve spectrum-efficiency on 5G mobile wireless networks.","2021","Computer Communications","Comput. Commun.","Lucas de Melo Guimarães;Jacir Luiz Bordim","0140-3664","A2"
"A systematic review on distributed denial of service attack defense mechanisms in programmable networks.","2021","International Journal of Network Management","Int. J. Netw. Manag.","Bruno Lopes Dalmazo;Jonatas Adilson Marques;Lucas Rodrigues Costa;Michel S. Bonfim;Ranyelson Neres Carvalho;Anderson Santos da Silva;Stenio Fernandes;Jacir Luiz Bordim;Eduardo Alchieri;Alberto Schaeffer-Filho;Luciano Paschoal Gaspary;Weverton Cordeiro","1055-7148","A4"
"A Rabin-Karp Implementation for Handling Multiple Pattern-Matching on the GPU.","2020","IEICE Transactions on Information &#38; Systems","IEICE Trans. Inf. Syst.","Lucas Saad Nogueira Nunes;Jacir Luiz Bordim;Yasuaki Ito;Koji Nakano","0916-8532","B1"
"Accelerating the Smith-Waterman Algorithm Using the Bitwise Parallel Bulk Computation Technique on the GPU.","2019","IEICE Transactions","IEICE Trans. Inf. Syst.","Takahiro Nishimura;Jacir Luiz Bordim;Yasuaki Ito;Koji Nakano","0019-0578","A1"
"Almost optimal column-wise prefix-sum computation on the GPU.","2018","The Journal of Supercomputing","J. Supercomput.","Hiroki Tokura;Toru Fujita;Koji Nakano;Yasuaki Ito;Jacir Luiz Bordim","0920-8542","A2"
"A Full-Duplex MAC Tailored for 5G Wireless Networks.","2018","Wireless Communications and Mobile Computing","Wirel. Commun. Mob. Comput.","Lucas de Melo Guimarães;Jacir Luiz Bordim","1530-8677","A3"
"A Cooperative Communication Model Tailored for Energy Balance in Wireless Sensor Networks.","2017","CLEI electronic journal","CLEI Electron. J.","Camila F. Rêgo;Rodrigo R. Bezerra;Ulisses R. Afonseca;Jacir Luiz Bordim","0717-5000","B2"
"Accelerating digital halftoning using the local exhaustive search on the GPU.","2017","Concurrency and Computation: Practice and Experience","Concurr. Comput. Pract. Exp.","Hiroaki Kouge;Takumi Honda;Toru Fujita;Yasuaki Ito;Koji Nakano;Jacir Luiz Bordim","1096-9128","A3"
"C2CU: a CUDA C program generator for bulk execution of a sequential algorithm.","2017","Concurrency and Computation: Practice and Experience","Concurr. Comput. Pract. Exp.","Daisuke Takafuji;Koji Nakano;Yasuaki Ito;Jacir Luiz Bordim","1096-9128","A3"
"CARCC: Connectivity Autorecovering via Cooperative Communication.","2017","Wireless Communications and Mobile Computing","Wirel. Commun. Mob. Comput.","Ulisses Rodrigues Afonseca;Camila F. Rêgo;Jacir Luiz Bordim","1530-8677","A3"
"An FPGA Implementation for a Flexible-Length-Arithmetic Processor Employing the FDFM Processor Core Approach.","2016","IEICE Transactions","IEICE Trans. Inf. Syst.","Tatsuya Kawamoto;Xin Zhou 0003;Jacir Luiz Bordim;Yasuaki Ito;Koji Nakano","0019-0578","A1"
"A Memory-Access-Efficient Implementation for Computing the Approximate String Matching Algorithm on GPUs.","2016","IEICE Transactions","IEICE Trans. Inf. Syst.","Lucas Saad N. Nunes;Jacir Luiz Bordim;Yasuaki Ito;Koji Nakano","0019-0578","A1"
"A Fast-and-Fair Collision Resolution Protocol Tailored for Ad Hoc Wireless Networks.","2016","Journal of Computer Science (JCS)","J. Comput. Sci.","Marcos F. Caetano;Lucas de Melo Guimarães;Jacir Luiz Bordim","1552-6607","B1"
"Using Pulse/Tone Signals as an Alternative to Boost Channel Reservation on Directional Communications.","2015","IEICE Transactions","IEICE Trans. Fundam. Electron. Commun. Comput. Sci.","Lucas de Melo Guimarães;Jacir Luiz Bordim;Koji Nakano","0019-0578","A1"
"Accuracy and Efficiency Performance of the ICP Procedure Applied to Sign Language Recognition.","2014","CLEI electronic journal","CLEI Electron. J.","Juarez Paulino da Silva Júnior;Marcus Vinicius Lamar;Jacir Luiz Bordim","0717-5000","B2"
"Employing Cooperative Communication to Recover Network Connectivity in Ad Hoc Networks.","2014","International Journal of Networking and Computing (IJNC)","Int. J. Netw. Comput.","Ulisses Rodrigues Afonseca;Thiago Fernandes Neves;Jacir Luiz Bordim","1476-8186","A3"
"Topology Control in Cooperative Ad Hoc Wireless Networks.","2013","Electronic Notes in Theoretical Computer Science (ENTCS)","CLEI Selected Papers","Thiago F. Neves;Jacir Luiz Bordim","N/A","N/A"
"A Proposal for the Description of Individual Course Units.","2013","International Journal of Engineering Pedagogy (iJEP)","Int. J. Eng. Pedagog.","João Paulo Barros;Luís Gomes 0001;Luís Garcia","0020-7225","A1"
"A review on preprocessing algorithm selection with meta-learning.","2024","Knowledge and Information Systems (KAIS)","Knowl. Inf. Syst.","Pedro B. Pio;Adriano Rivolli;André C. P. L. F. de Carvalho;Luís Paulo F. Garcia","0219-1377","A2"
"Neural architecture search with interpretable meta-features and fast predictors.","2023","Information Sciences","Inf. Sci.","Gean Trindade Pereira;Iury Batista de Andrade Santos;Luís Paulo F. Garcia;Thierry Urruty;Muriel Visani;André C. P. L. F. de Carvalho","0020-0255","A1"
"Meta-features for meta-learning.","2022","Knowledge-Based Systems","Knowl. Based Syst.","Adriano Rivolli;Luís Paulo F. Garcia;Carlos Soares;Joaquin Vanschoren;André C. P. L. F. de Carvalho","0950-7051","A1"
"Assessing the data complexity of imbalanced datasets.","2021","Information Sciences","Inf. Sci.","Victor H. Barella;Luís Paulo F. Garcia;Marcilio C. P. de Souto;Ana Carolina Lorena;André C. P. L. F. de Carvalho","0020-0255","A1"
"An Anomaly-based Multi-class Classifier for Network Intrusion Detection.","2021","Computing Research Repository (CoRR)","CoRR","Manuela M. C. de Souza;Camila F. T. Pontes;João J. C. Gondim;Luís Paulo F. Garcia;Luiz A. DaSilva;Marcelo Antonio Marotta","N/A","N/A"
"Boosting meta-learning with simulated data complexity measures.","2020","Intelligent Data Analysis","Intell. Data Anal.","Luís Paulo F. Garcia;Adriano Rivolli;Edesio Alcobaça;Ana Carolina Lorena;André C. P. L. F. de Carvalho","1088-467X","B2"
"MFE: Towards reproducible meta-feature extraction.","2020","Journal of Machine Learning Research (JMLR)","J. Mach. Learn. Res.","Edesio Alcobaça;Felipe Siqueira;Adriano Rivolli;Luís Paulo F. Garcia;Jefferson Tales Oliva;André C. P. L. F. de Carvalho","1532-4435","A1"
"New label noise injection methods for the evaluation of noise filters.","2019","Knowledge-Based Systems","Knowl. Based Syst.","Luís Paulo F. Garcia;Jens Lehmann 0001;André C. P. L. F. de Carvalho;Ana Carolina Lorena","0950-7051","A1"
"Towards Reproducible Empirical Research in Meta-Learning.","2018","Computing Research Repository (CoRR)","CoRR","Adriano Rivolli;Luís Paulo F. Garcia;Carlos Soares;Joaquin Vanschoren;André C. P. L. F. de Carvalho","N/A","N/A"
"The NoiseFiltersR Package: Label Noise Preprocessing in R.","2017","The R Journal","R J.","Pablo Morales-Álvarez;Julián Luengo;Luís Paulo F. Garcia;Ana Carolina Lorena;André C. P. L. F. de Carvalho;Francisco Herrera","2073-4859","A2"
"Ensembles of label noise filters: a ranking approach.","2016","Data Mining and Knowledge Discovery","Data Min. Knowl. Discov.","Luís Paulo F. Garcia;Ana Carolina Lorena;Stan Matwin;André Carlos Ponce de Leon Ferreira de Carvalho","1384-5810","A1"
"Noise detection in the meta-learning level.","2016","Neurocomputing","Neurocomputing","Luís Paulo F. Garcia;André C. P. L. F. de Carvalho;Ana Carolina Lorena","N/A","N/A"
"Effect of label noise in the complexity of classification problems.","2015","Neurocomputing","Neurocomputing","Luís Paulo F. Garcia;André C. P. L. F. de Carvalho;Ana Carolina Lorena","N/A","N/A"
"Using the One-vs-One decomposition to improve the performance of class noise filters via an aggregation strategy in multi-class classification problems.","2015","Knowledge-Based Systems","Knowl. Based Syst.","Luís Paulo F. Garcia;José A. Sáez;Julián Luengo;Ana Carolina Lorena;André C. P. L. F. de Carvalho;Francisco Herrera","0950-7051","A1"
"Applying One-Class Algorithms for Data Stream-Based Insider Threat Detection.","2023","IEEE Access","IEEE Access","Rafael Bruno Peccatiello;João José Costa Gondim;Luís Paulo Faina Garcia","2169-3536","A3"
"Towards holistic Entity Linking: Survey and directions.","2021","Information Systems","Inf. Syst.","Italo Lopes Oliveira;Renato Fileto;René Speck;Luís Paulo F. Garcia;Diego Moussallem;Jens Lehmann 0001","0306-4379","A2"
"How Complex Is Your Classification Problem?: A Survey on Measuring Classification Complexity.","2019","ACM Computing Surveys","ACM Comput. Surv.","Ana Carolina Lorena;Luís Paulo F. Garcia;Jens Lehmann 0001;Marcílio Carlos Pereira de Souto;Tin Kam Ho","0360-0300","A1"
